{
  "schemaVersion": "1.7",
  "repository": {
    "name": "sample-service",
    "commitSha": "0123456789abcdef0123456789abcdef01234567",
    "branch": "main",
    "remoteUrl": "https://github.com/example/sample-service.git",
    "isDirty": false
  },
  "dotNetSdk": {
    "globalJsonPath": "global.json",
    "configured": {
      "version": "10.0.100",
      "rollForward": "latestFeature",
      "allowPrerelease": false
    },
    "resolvedVersion": "10.0.100"
  },
  "projects": [
    {
      "path": "src/App/App.csproj",
      "name": "App",
      "resolvedSdkVersion": "10.0.100",
      "sdks": [
        {
          "name": "Microsoft.NET.Sdk.Web"
        }
      ],
      "targetFrameworks": [
        "net10.0"
      ],
      "outputType": "Exe",
      "isTestProject": false,
      "isPackable": false,
      "runtimeIdentifiers": [],
      "classification": {
        "kind": "web",
        "confidence": "high",
        "signals": [
          "sdk:Microsoft.NET.Sdk.Web"
        ]
      },
      "references": [
        {
          "path": "src/Core/Core.csproj"
        }
      ],
      "diagnostics": [],
      "publication": {
        "selfContained": {
          "state": "evaluated",
          "value": false
        },
        "publishSelfContained": {
          "state": "evaluated",
          "value": true
        },
        "publishAot": {
          "state": "evaluated",
          "value": false
        },
        "publishTrimmed": {
          "state": "unspecified"
        },
        "runtimeFrameworkVersion": {
          "state": "context-dependent"
        }
      }
    }
  ],
  "diagnostics": [
    {
      "code": "DRI1003",
      "severity": "warning",
      "message": "A project reference could not be resolved.",
      "source": "src/App/App.csproj",
      "context": {
        "reference": "src/Missing/Missing.csproj"
      }
    }
  ],
  "policyFindings": [],
  "integrations": [
    {
      "id": "integration-6e7ab864fd3b45dc",
      "projectPath": "src/App/App.csproj",
      "kind": "http",
      "direction": "outbound",
      "technology": "refit",
      "target": "Serasa",
      "configurationKey": "Serasa:BaseUrl",
      "contract": "ISerasaApi",
      "source": {
        "path": "src/App/SerasaClient.cs",
        "line": 42
      },
      "confidence": "high",
      "signals": [
        "http:client",
        "refit:contract"
      ]
    }
  ],
  "integrationDiscovery": {
    "enabled": true,
    "completed": true,
    "truncated": false
  },
  "containerImages": [
    {
      "imageReference": "mcr.microsoft.com/dotnet/sdk:10.0@sha256:aaaaaaaaaaaaaaaaaaaaaaaaaaaaaaaaaaaaaaaaaaaaaaaaaaaaaaaaaaaaaaaa",
      "registry": "mcr.microsoft.com",
      "repository": "dotnet/sdk",
      "tag": "10.0",
      "digest": "sha256:aaaaaaaaaaaaaaaaaaaaaaaaaaaaaaaaaaaaaaaaaaaaaaaaaaaaaaaaaaaaaaaa",
      "stageAlias": "build",
      "referenceKind": "external",
      "resolutionStatus": "resolved",
      "dotNetFamily": "sdk",
      "isOfficialDotNetImage": true,
      "source": {
        "path": "Dockerfile",
        "line": 1
      }
    },
    {
      "imageReference": "build",
      "stageAlias": "publish",
      "referenceKind": "stage",
      "resolutionStatus": "resolved",
      "isOfficialDotNetImage": false,
      "source": {
        "path": "Dockerfile",
        "line": 5
      }
    },
    {
      "stageAlias": "dynamic",
      "referenceKind": "external",
      "resolutionStatus": "unresolved",
      "isOfficialDotNetImage": false,
      "source": {
        "path": "Dockerfile",
        "line": 9
      }
    }
  ],
  "containerDiscovery": {
    "enabled": true,
    "completed": true,
    "truncated": false
  }
}
